{
  "schema_version": 1,
  "hardware_id": "special-amd-bc250-16g",
  "configuration_id": "stock-vulkan",
  "workload_class": "llm",
  "adapter": {
    "type": "llama_cpp",
    "binary": "llama-bench",
    "backend": "Vulkan",
    "extra_args": [
      "-ngl",
      "all"
    ],
    "timeout_s": 1800
  },
  "model": {
    "name": "shared-test-model",
    "path": "/models/shared-test-model.Q4_K_M.gguf",
    "quantization": "Q4_K_M"
  },
  "workload": {
    "context_tokens": 4096,
    "context_depth_tokens": 512,
    "prompt_tokens": 512,
    "generated_tokens": 128,
    "runs": 5
  },
  "power": {
    "provider": "none",
    "scope": "unknown"
  }
}
